{"asof":"2026-10-22","in_forecast":false,"in_forecast_note":"La presse et l'attention en ligne n'entrent pas dans la prévision. L'attention Wikipédia a été testée (docs/06-presse.md) : elle précède les sondages d'une à quatre semaines autour des événements, mais l'effet disparaît hors événements et la causalité inverse est aussi significative ; elle n'est pas retenue. Les titres classés par un modèle local (ton, posture, thèmes) ont été testés à leur tour : résultat négatif, ils sont montrés à titre descriptif.","nlp":{"in_forecast":false,"note":"Environ 58 000 titres de presse (Media Cloud, campagnes 2017, 2022 et 2027) classés par un modèle de langue local : ton, posture, thèmes. Volet descriptif : il sépare une couverture abondante et favorable d'une couverture abondante et hostile, ce que les comptages confondent.","verdict":["Le ton a le signe attendu dans les trois campagnes, mais son effet sur les sondages des deux semaines suivantes ne se distingue pas du hasard (placebo p = 0,59).","Autour des chocs, la presse enregistre en même temps que les sondages (Fillon 2017) ou après eux (Pécresse 2022), et l'agenda par thèmes classés ne précède rien."],"out_of_sample_test":"Test hors échantillon déclaré pour 2027 : pour chaque candidat officiel, ton moyen des 28 jours avant le premier tour (même prompt, même modèle) contre résultat moins moyenne des sondages des 14 derniers jours ; prédiction : un meilleur ton va avec une surperformance (β > 0). En 2017 et 2022 : β = +6, p = 0,06, n = 23, porté par 2022.","reference":"docs/06-presse.md"},"tone":{"note":"Ton moyen des titres qui nomment le candidat, de −1 (hostile) à +1 (favorable), sur deux semaines glissantes ; bande : intervalle à 90 % par rééchantillonnage des titres. Masqué sous 10 titres classés. Le ton est la mesure la moins fiable des trois (accord κ = 0,60 entre deux formulations du prompt).","window_weeks":2,"min_titles":10,"weeks":["2026-01-05","2026-01-12","2026-01-19","2026-01-26","2026-02-02","2026-02-09","2026-02-16","2026-02-23","2026-03-02","2026-03-09","2026-03-16","2026-03-23","2026-03-30","2026-04-06","2026-04-13","2026-04-20","2026-04-27","2026-05-04","2026-05-11","2026-05-18","2026-05-25","2026-06-01","2026-06-08","2026-06-15","2026-06-22","2026-06-29","2026-07-06","2026-07-13","2026-07-20","2026-07-27","2026-08-03","2026-08-10","2026-08-17","2026-08-24","2026-08-31","2026-09-07","2026-09-14","2026-09-21","2026-09-28","2026-10-05","2026-10-12"],"tracks":[{"candidate_id":"le_pen_marine","q05":[-0.22,-0.15,-0.13,-0.14,-0.36,-0.32,-0.2,-0.08,-0.03,-0.04,-0.18,-0.04,0.0,-0.34,-0.46,-0.39,-0.12,-0.06,-0.18,-0.18,-0.32,-0.55,-0.22,-0.21,-0.28,-0.13,-0.17,-0.23,-0.36,-0.37,-0.31,-0.38,-0.26,-0.05,-0.03,-0.03,-0.05,-0.11,-0.24,-0.3,-0.18],"q50":[-0.1,-0.08,-0.07,-0.04,-0.28,-0.26,-0.13,0.01,0.05,0.13,-0.05,0.07,0.12,-0.16,-0.33,-0.29,-0.03,0.04,-0.06,-0.1,-0.22,-0.36,-0.11,-0.11,-0.15,-0.06,-0.12,-0.18,-0.27,-0.22,-0.13,-0.17,-0.1,0.03,0.04,0.04,-0.01,-0.06,-0.16,-0.24,-0.11],"q95":[0.02,-0.03,-0.02,0.05,-0.19,-0.2,-0.06,0.1,0.13,0.3,0.11,0.21,0.25,0.03,-0.21,-0.18,0.06,0.14,0.08,-0.01,-0.12,-0.18,-0.02,0.0,0.0,0.02,-0.07,-0.12,-0.16,-0.06,0.04,0.07,0.07,0.11,0.12,0.11,0.04,0.0,-0.08,-0.16,-0.06],"n":[50,236,285,118,167,225,90,113,122,23,44,67,56,38,52,56,99,96,50,71,60,33,54,66,47,175,451,421,157,65,45,29,42,190,268,283,344,246,225,280,331]},{"candidate_id":"glucksmann_raphael","q05":[null,-0.58,-0.36,-0.16,-0.12,-0.17,null,-0.53,-0.72,-0.51,-0.1,-0.33,null,null,-0.67,0.0,-0.19,-0.25,-0.71,-0.57,-0.27,-0.27,-0.11,-0.09,-0.37,-0.33,-0.23,-0.21,-0.27,null,-0.65,-0.46,0.0,0.08,-0.0,-0.38,-0.3,-0.32,-0.37,0.19,0.28],"q50":[null,-0.33,-0.14,-0.03,0.02,0.06,null,-0.33,-0.57,-0.36,0.05,-0.17,null,null,-0.42,0.0,-0.06,-0.08,-0.55,-0.43,-0.2,-0.2,-0.03,0.01,-0.2,-0.13,-0.1,-0.09,-0.09,null,-0.55,-0.36,0.07,0.13,0.06,-0.29,-0.2,-0.22,-0.28,0.27,0.34],"q95":[null,-0.08,0.07,0.09,0.17,0.28,null,-0.13,-0.42,-0.2,0.2,0.0,null,null,-0.17,0.0,0.0,0.0,-0.39,-0.3,-0.13,-0.13,0.06,0.11,-0.02,0.07,0.0,0.0,0.0,null,-0.44,-0.26,0.13,0.19,0.13,-0.19,-0.11,-0.12,-0.19,0.35,0.41],"n":[7,12,14,32,42,18,7,15,40,45,20,12,8,9,12,19,16,12,31,53,113,142,149,121,41,15,31,34,11,9,66,103,149,300,243,119,127,121,143,252,389]},{"candidate_id":"bardella_jordan","q05":[-0.57,-0.25,-0.11,-0.27,-0.16,-0.26,-0.4,-0.14,-0.08,-0.15,-0.15,-0.1,-0.33,-0.26,-0.24,-0.26,-0.24,-0.24,-0.22,-0.23,-0.28,-0.21,-0.16,-0.22,-0.24,-0.09,-0.13,-0.24,-0.56,-0.54,-0.67,-0.4,-0.33,-0.18,-0.22,-0.3,-0.32,-0.18,-0.55,-0.59,-0.51],"q50":[-0.4,-0.14,-0.03,-0.15,-0.07,-0.16,-0.3,-0.06,0.01,-0.01,-0.04,0.01,-0.14,-0.19,-0.19,-0.2,-0.18,-0.18,-0.14,-0.14,-0.17,-0.12,-0.07,-0.14,-0.14,0.01,-0.06,-0.17,-0.41,-0.29,-0.42,-0.23,-0.15,-0.09,-0.15,-0.23,-0.25,-0.09,-0.48,-0.53,-0.44],"q95":[-0.23,-0.04,0.06,-0.03,0.01,-0.08,-0.2,0.01,0.09,0.12,0.07,0.13,0.04,-0.1,-0.14,-0.14,-0.12,-0.11,-0.07,-0.07,-0.08,-0.02,0.01,-0.07,-0.04,0.11,0.0,-0.09,-0.26,-0.08,-0.17,-0.05,0.03,0.0,-0.08,-0.16,-0.17,0.01,-0.42,-0.48,-0.37],"n":[40,97,106,74,128,128,93,134,119,81,91,78,49,129,226,219,211,201,167,120,115,128,135,146,98,131,242,167,34,24,24,40,39,93,225,220,130,82,329,425,189]},{"candidate_id":"melenchon_jean_luc","q05":[-0.58,-0.5,-0.5,-0.54,-0.58,-0.49,-0.56,-0.64,-0.7,-0.7,-0.48,-0.56,-0.61,-0.47,-0.56,-0.81,-0.15,-0.18,-0.32,-0.66,-0.26,-0.18,-0.26,-0.29,-0.35,-0.32,-0.25,-0.28,-0.26,-0.35,-0.7,-0.45,-0.14,-0.15,-0.31,-0.33,-0.3,-0.28,-0.34,-0.32,-0.23],"q50":[-0.42,-0.33,-0.29,-0.39,-0.42,-0.33,-0.47,-0.59,-0.66,-0.64,-0.37,-0.45,-0.51,-0.34,-0.4,-0.67,-0.07,-0.13,-0.25,-0.53,-0.15,-0.1,-0.18,-0.19,-0.21,-0.21,-0.14,-0.15,-0.13,-0.16,-0.5,-0.32,-0.07,-0.09,-0.23,-0.26,-0.23,-0.19,-0.27,-0.26,-0.17],"q95":[-0.26,-0.17,-0.09,-0.24,-0.26,-0.15,-0.37,-0.54,-0.61,-0.57,-0.26,-0.34,-0.41,-0.19,-0.21,-0.5,0.01,-0.07,-0.18,-0.4,-0.05,-0.03,-0.1,-0.09,-0.07,-0.1,-0.03,-0.01,-0.01,0.0,-0.3,-0.19,-0.01,-0.03,-0.15,-0.19,-0.14,-0.1,-0.19,-0.2,-0.11],"n":[38,42,34,46,38,39,100,319,387,199,118,121,98,59,43,42,135,323,240,58,130,232,227,139,72,134,143,82,68,37,20,53,230,342,252,218,174,131,195,275,313]},{"candidate_id":"attal_gabriel","q05":[null,-0.31,-0.07,-0.23,-0.31,-0.2,-0.33,-0.33,-0.15,-0.33,-0.28,-0.27,-0.31,-0.31,-0.21,-0.31,-0.26,-0.16,0.03,0.01,-0.09,-0.12,-0.19,-0.18,-0.31,-0.35,-0.27,-0.27,-0.2,-0.27,-0.52,-0.47,-0.53,-0.31,-0.18,-0.24,-0.17,-0.15,-0.27,-0.14,-0.12],"q50":[null,-0.08,0.07,-0.13,-0.19,-0.04,-0.17,-0.17,0.0,-0.14,-0.12,-0.09,-0.14,-0.12,-0.09,-0.23,-0.18,-0.07,0.14,0.08,-0.02,-0.05,-0.09,-0.08,-0.2,-0.26,-0.16,-0.16,-0.11,-0.17,-0.45,-0.4,-0.43,-0.24,-0.12,-0.17,-0.09,-0.08,-0.2,-0.07,-0.04],"q95":[null,0.15,0.21,-0.01,-0.06,0.12,0.0,0.0,0.15,0.05,0.03,0.06,0.03,0.08,0.03,-0.14,-0.11,0.01,0.27,0.17,0.03,0.03,0.01,0.02,-0.09,-0.17,-0.07,-0.05,-0.01,-0.07,-0.38,-0.32,-0.34,-0.17,-0.06,-0.1,-0.01,0.0,-0.13,-0.01,0.04],"n":[7,13,28,77,64,25,30,18,13,21,32,33,29,26,66,119,156,145,97,180,290,199,68,51,54,80,75,62,104,109,164,154,88,172,195,156,136,127,131,151,120]},{"candidate_id":"philippe_edouard","q05":[null,null,-0.27,-0.2,-0.22,-0.14,0.0,-0.71,-0.73,0.2,0.41,0.42,0.2,-0.12,-0.22,-0.08,-0.48,-0.17,-0.14,-0.62,-0.49,-0.06,0.07,-0.1,-0.15,0.21,0.18,-0.28,-0.63,-0.58,-0.45,-0.59,-0.06,-0.04,-0.1,-0.23,-0.26,-0.29,-0.29,-0.22,-0.15],"q50":[null,null,-0.13,-0.08,-0.11,0.0,0.09,-0.54,-0.55,0.34,0.5,0.52,0.31,0.03,-0.05,0.12,-0.26,-0.06,-0.03,-0.51,-0.4,0.02,0.18,0.02,-0.02,0.28,0.25,-0.14,-0.43,-0.39,-0.29,-0.36,0.02,0.01,-0.04,-0.15,-0.18,-0.19,-0.21,-0.15,-0.09],"q95":[null,null,0.0,0.0,0.0,0.14,0.27,-0.36,-0.36,0.48,0.6,0.61,0.43,0.17,0.14,0.31,0.0,0.06,0.08,-0.41,-0.33,0.11,0.32,0.15,0.13,0.35,0.33,0.0,-0.23,-0.16,-0.13,-0.14,0.11,0.07,0.02,-0.06,-0.11,-0.09,-0.13,-0.08,-0.02],"n":[4,6,15,25,18,14,11,28,33,64,124,118,103,69,37,26,19,81,96,106,144,93,44,41,53,200,221,71,35,31,31,22,170,330,227,142,131,80,124,162,127]},{"candidate_id":"retailleau_bruno","q05":[-0.05,0.03,-0.25,-0.24,-0.11,-0.08,-0.06,-0.1,-0.25,-0.22,-0.34,-0.38,-0.31,-0.4,0.02,0.07,-0.15,-0.19,-0.11,-0.07,-0.17,-0.09,-0.19,0.05,0.17,-0.43,-0.36,-0.13,-0.18,0.0,0.0,null,null,-0.03,-0.06,-0.15,-0.11,-0.03,-0.14,-0.25,-0.25],"q50":[0.14,0.17,-0.04,0.0,0.07,0.03,0.05,0.02,-0.13,-0.06,-0.22,-0.31,-0.19,-0.25,0.14,0.16,-0.05,-0.09,0.0,0.07,-0.04,0.0,-0.1,0.14,0.27,-0.31,-0.26,-0.02,-0.07,0.0,0.0,null,null,0.07,0.01,-0.09,-0.04,0.06,-0.05,-0.16,-0.16],"q95":[0.32,0.32,0.17,0.24,0.25,0.12,0.15,0.12,-0.02,0.11,-0.11,-0.21,-0.08,-0.1,0.26,0.25,0.04,-0.01,0.11,0.22,0.08,0.11,-0.01,0.24,0.37,-0.21,-0.15,0.09,0.04,0.0,0.0,null,null,0.17,0.08,-0.02,0.03,0.14,0.04,-0.07,-0.06],"n":[22,35,24,21,28,105,109,52,53,36,89,104,62,48,90,139,131,118,73,27,24,65,100,133,102,86,97,55,28,12,12,9,9,58,131,173,159,118,110,101,109]},{"candidate_id":"tondelier_marine","q05":[null,-0.3,-0.2,-0.64,-0.43,-0.29,null,-0.39,-0.3,-0.26,-0.32,-0.53,-0.27,-0.27,-0.54,-0.41,-0.45,-0.49,-0.56,null,-0.26,-0.21,-0.15,-0.3,-0.42,-0.41,-0.32,-0.14,-0.15,-0.39,-0.45,-0.31,-0.12,-0.15,-0.16,-0.22,-0.3,-0.16,-0.07,-0.33,-0.29],"q50":[null,0.0,0.1,-0.36,-0.26,-0.1,null,-0.17,-0.11,-0.09,-0.14,-0.35,-0.16,-0.16,-0.38,-0.23,-0.29,-0.36,-0.4,null,-0.15,-0.12,-0.07,-0.15,-0.27,-0.28,-0.09,0.04,0.05,-0.21,-0.31,-0.19,-0.03,-0.05,-0.07,-0.14,-0.22,-0.09,0.0,-0.14,-0.19],"q95":[null,0.3,0.4,-0.18,-0.09,0.1,null,0.06,0.07,0.13,0.04,-0.15,-0.06,-0.05,-0.23,-0.05,-0.13,-0.23,-0.24,null,-0.04,-0.03,0.0,-0.04,-0.15,-0.14,0.14,0.21,0.25,-0.03,-0.16,-0.1,0.07,0.05,0.0,-0.07,-0.14,-0.02,0.09,0.05,-0.08],"n":[6,10,10,11,23,21,8,18,27,23,28,40,67,63,26,22,31,39,25,6,27,34,27,27,33,29,22,28,20,33,49,52,58,61,55,69,79,86,58,21,48]},{"candidate_id":"roussel_fabien","q05":[null,null,null,null,null,null,null,null,null,null,null,null,-0.44,-0.63,-0.94,null,null,null,null,0.0,null,null,null,null,null,0.24,0.19,null,null,null,null,null,0.0,0.0,-0.03,-0.06,-0.15,-0.29,-0.21,-0.05,-0.1],"q50":[null,null,null,null,null,null,null,null,null,null,null,null,-0.25,-0.48,-0.78,null,null,null,null,0.08,null,null,null,null,null,0.3